{"$schema":"https://json-schema.org/draft/2020-12/schema","$id":"https://securethecloud.dev/schemas/portfolio/module_registry.schema.json","title":"SecureTheCloud Module Registry Contract","type":"object","required":["contract_name","contract_version","doctrine_phase","last_updated","sharing_status","default_unregistered_module_rule","modules"],"additionalProperties":false,"properties":{"contract_name":{"const":"securethecloud_module_registry"},"contract_version":{"type":"string"},"doctrine_phase":{"type":"string"},"last_updated":{"type":"string","pattern":"^\\d{4}-\\d{2}-\\d{2}$"},"sharing_status":{"type":"string","enum":["active_machine_readable_contract"]},"default_unregistered_module_rule":{"type":"string"},"modules":{"type":"array","minItems":1,"items":{"type":"object","required":["module_id","module_name","category","lifecycle_status","membership","customer_visible","description"],"additionalProperties":false,"properties":{"module_id":{"type":"string","pattern":"^[a-z0-9_]+$"},"module_name":{"type":"string"},"category":{"type":"string"},"lifecycle_status":{"type":"string"},"membership":{"type":"array","minItems":1,"items":{"type":"string"}},"customer_visible":{"type":"boolean"},"description":{"type":"string"}}}}}}
